Questions,Yes,No,Clarification,Unique Identifier
Do you proactively monitor running of systems and system components to automatically identify faults and technical issues?,1 Line down,1 Line down,,223confirm monitor running of system
Do you have a documented roadmap for the future development of your product?,1 Line down,2 Lines down,,224confirm documented roadmap
"Can you provide details of planned development, technical updates and potential release dates?",1 Line down,1 Line down,,225confirm details of development
Do you have a documented roadmap for the future development of your product?,1 Line down,2 Lines down,,226confirm roadmap for future
Can you provide details of how you will ensure the continued availability of your product?,1 Line down,1 Line down,,227provide ensure availibility 
Do you have a plan for decommissioning your product?,1 Line down,4 Lines down,,228decommissioning
Can you describe your processes for decommissioning your product and dealing with any retained identifiable data?,1 Line down,1 Line down,,229provide decommissioning
Do you have a plan for dealing with any retained identifiable data in the event that an individual stops using your product? For example by uninstalling or unsubscribing?,1 Line down,1 Line down,,230provide identifiable data
Can you describe your processes for dealing with any retained identifiable data in the event that an individual stops using your product?,1 Line down,1 Line down,,231provide retained identifiable
Great! You’re all set! You can view suggested next steps by clicking on “Suggestions” in the navigation bar above.,The session has ended,The session has ended,,end
